{
  "schema_version": 1,
  "family_id": "family-example",
  "method": "holm",
  "alpha": 0.05,
  "expected_comparisons": [
    {
      "tier": "core",
      "budget": 4,
      "alternative": "simulation_informed",
      "reference": "cvss",
      "outcome": "mission_impact"
    },
    {
      "tier": "edge",
      "budget": 6,
      "alternative": "heuristic",
      "reference": "cvss",
      "outcome": "mission_impact"
    }
  ],
  "raw_results": [
    {
      "identity": {
        "tier": "core",
        "budget": 4,
        "alternative": "simulation_informed",
        "reference": "cvss",
        "outcome": "mission_impact"
      },
      "raw_p_value": 0.001996007984031936
    },
    {
      "identity": {
        "tier": "edge",
        "budget": 6,
        "alternative": "heuristic",
        "reference": "cvss",
        "outcome": "mission_impact"
      },
      "raw_p_value": 0.001996007984031936
    }
  ]
}
